{"schema_version":"1.0.0","run_id":"abk:run:artifact-dag-core-v1-abk-native-spc-01-domain-boundary-r1","request_id":"abk:run-request:artifact-dag-core-v1-abk-native-spc-01-domain-boundary-r1","campaign_id":"abk:benchmark-campaign:artifact-dag-core-v1","branch":"abk_native","branch_id":"abk_native","case_id":"SPC-01-domain-boundary","repeat":1,"runner":{"contract_version":"abk-native-runner-v2","executable_sha256":"14cd7ea73cf99bae9ba3b59659341aab80c1d8ed0266bd6e3074e98b4a00954c","host":"codex"},"input":{"fixture_sha256":"7232aaa098862821374ad852d0c07d6a82f83928ec8bdfd0738e1132a726cfb9","campaign_sha256":"471b4f31608781205ce71d497add92d15659003a2a5852f1cc7fb59330b320d3","schema_sha256":"b4cacc60fe730faab91595f3f00b73ddf8729b494413a5eab5fa295e494b8aff","request_sha256":"d91e241597dad3d953ff17abbce7dd8c513e1c338ea771e098cded383d1c1ed4"},"started_at":"2026-08-04T21:14:48Z","ended_at":"2026-08-04T21:14:49Z","duration_ms":271,"terminal_state":"REJECTED","exit_code":2,"error":{"code":"DEPENDENCY_OUT_OF_ROOT","retryable":false,"message":"Formation 'spec' contains an out-of-root prerequisite '../outside'.","field":"project.artifacts.depends_on"},"readiness":{"relative_path":"readiness.json","sha256":"9659a60983868c1e114056b36d09a479966ff566ed39719cb69f6e1ae27650a1"},"provenance":{"relative_path":"provenance.json","sha256":"1e74ffb48c19b09fce019a429d69093fb95461c370b1480eebd60bf1dc8acc09"},"state_before":{"manifest_sha256":"0000000000000000000000000000000000000000000000000000000000000000"},"state_after":{"manifest_sha256":"0000000000000000000000000000000000000000000000000000000000000000"},"recovery":null,"handoff":null}