{"schema_version":"1.0.0","run_id":"abk:run:artifact-dag-core-v1-abk-native-com-06-stop-interrupt-r2","request_id":"abk:run-request:artifact-dag-core-v1-abk-native-com-06-stop-interrupt-r2","campaign_id":"abk:benchmark-campaign:artifact-dag-core-v1","branch":"abk_native","branch_id":"abk_native","case_id":"COM-06-stop-interrupt","repeat":2,"runner":{"contract_version":"abk-native-runner-v2","executable_sha256":"14cd7ea73cf99bae9ba3b59659341aab80c1d8ed0266bd6e3074e98b4a00954c","host":"codex"},"input":{"fixture_sha256":"177325140d819ca9ce3416409a70122911a4f44148a8a788e3a0de5505b53c40","campaign_sha256":"471b4f31608781205ce71d497add92d15659003a2a5852f1cc7fb59330b320d3","schema_sha256":"b4cacc60fe730faab91595f3f00b73ddf8729b494413a5eab5fa295e494b8aff","request_sha256":"07e56c2badcbae8e04c9a79ece3b7c189efa17eb9da60fc866b48138a3f31fdf"},"started_at":"2026-08-04T22:35:39Z","ended_at":"2026-08-04T22:35:40Z","duration_ms":256,"terminal_state":"STOPPED","exit_code":130,"error":{"code":"INTERRUPTED","retryable":false,"message":"The declared plan-read interrupt stopped the ABK-native run.","field":"project.interrupt_after"},"readiness":{"relative_path":"readiness.json","sha256":"415ae161a9a1a809b6aaa611bc88cd47b0ce6b1bdfedaefe913a7f901597c2b4"},"provenance":{"relative_path":"provenance.json","sha256":"d3337b2df589e311ce5c51128bdea6df22f46bc5b2d22b0b457ead6fa5c95cc9"},"state_before":{"manifest_sha256":"0000000000000000000000000000000000000000000000000000000000000000"},"state_after":{"manifest_sha256":"0000000000000000000000000000000000000000000000000000000000000000"},"recovery":null,"handoff":null}