{"schema_version":"1.0.0","run_id":"abk:run:artifact-dag-core-v1-abk-native-spc-04-composition-handoff-r2","request_id":"abk:run-request:artifact-dag-core-v1-abk-native-spc-04-composition-handoff-r2","campaign_id":"abk:benchmark-campaign:artifact-dag-core-v1","branch":"abk_native","branch_id":"abk_native","case_id":"SPC-04-composition-handoff","repeat":2,"runner":{"contract_version":"abk-native-runner-v2","executable_sha256":"14cd7ea73cf99bae9ba3b59659341aab80c1d8ed0266bd6e3074e98b4a00954c","host":"codex"},"input":{"fixture_sha256":"7ef01303a6b87f5a07fc187a09002b613f5ae405b3095babfde8b6ac2da6d4c3","campaign_sha256":"471b4f31608781205ce71d497add92d15659003a2a5852f1cc7fb59330b320d3","schema_sha256":"b4cacc60fe730faab91595f3f00b73ddf8729b494413a5eab5fa295e494b8aff","request_sha256":"b206a5380e113081debd8f51453f8f044d67950dfeca4460e2d30c1ab1d8c238"},"started_at":"2026-08-04T22:35:56Z","ended_at":"2026-08-04T22:35:56Z","duration_ms":325,"terminal_state":"SUCCEEDED","exit_code":0,"error":null,"readiness":{"relative_path":"readiness.json","sha256":"c2d3a58fa760756782d254360cf972e84d97a636a73b59d868d21261e92685ff"},"provenance":{"relative_path":"provenance.json","sha256":"09cd2a6fef718c825bc25886be355448c0edf77931cb9b99ac4754f2a16f48cd"},"state_before":{"manifest_sha256":"0000000000000000000000000000000000000000000000000000000000000000"},"state_after":{"manifest_sha256":"0000000000000000000000000000000000000000000000000000000000000000"},"recovery":null,"handoff":{"status":"validated","receiver":"abk-native-oracle","graph_sha256":"eba04aa50dd1b3b569daf7fc6da40c0300a3b817500f41db5b9294b3d96a1cf9","provenance_sha256":"09cd2a6fef718c825bc25886be355448c0edf77931cb9b99ac4754f2a16f48cd","verified":true}}