{"schema_version":"1.0.0","run_id":"abk:run:artifact-dag-core-v1-abk-native-com-04-boundary-minimum-r1","request_id":"abk:run-request:artifact-dag-core-v1-abk-native-com-04-boundary-minimum-r1","campaign_id":"abk:benchmark-campaign:artifact-dag-core-v1","branch":"abk_native","branch_id":"abk_native","case_id":"COM-04-boundary-minimum","repeat":1,"runner":{"contract_version":"abk-native-runner-v2","executable_sha256":"14cd7ea73cf99bae9ba3b59659341aab80c1d8ed0266bd6e3074e98b4a00954c","host":"codex"},"input":{"fixture_sha256":"dca00b56517ec5eaf491ba3d071f4da9823918c7ab78b168ff02ac971875d686","campaign_sha256":"471b4f31608781205ce71d497add92d15659003a2a5852f1cc7fb59330b320d3","schema_sha256":"b4cacc60fe730faab91595f3f00b73ddf8729b494413a5eab5fa295e494b8aff","request_sha256":"cce8a8de46a3ccc05861f1e0e582a1235c124d238d36555512cfc8d591b88f30"},"started_at":"2026-08-04T22:35:31Z","ended_at":"2026-08-04T22:35:31Z","duration_ms":324,"terminal_state":"SUCCEEDED","exit_code":0,"error":null,"readiness":{"relative_path":"readiness.json","sha256":"7e4a5f6746307960633810defbb6ada0e8a3008f1b26fca3278a96c78fa749bc"},"provenance":{"relative_path":"provenance.json","sha256":"c523c3fdb0162fb48fa5a202513509f37e840e633a89afc0aed5571b4ce825d7"},"state_before":{"manifest_sha256":"0000000000000000000000000000000000000000000000000000000000000000"},"state_after":{"manifest_sha256":"0000000000000000000000000000000000000000000000000000000000000000"},"recovery":null,"handoff":null}