{"schema_version":"1.0.0","run_id":"abk:run:artifact-dag-core-v1-abk-native-com-03-normal-repeat-r2","request_id":"abk:run-request:artifact-dag-core-v1-abk-native-com-03-normal-repeat-r2","campaign_id":"abk:benchmark-campaign:artifact-dag-core-v1","branch":"abk_native","branch_id":"abk_native","case_id":"COM-03-normal-repeat","repeat":2,"runner":{"contract_version":"abk-native-runner-v2","executable_sha256":"14cd7ea73cf99bae9ba3b59659341aab80c1d8ed0266bd6e3074e98b4a00954c","host":"codex"},"input":{"fixture_sha256":"a337f79552f96b4dba030fa08f4e58cf760ee26a770d45b54d4946dbb7f5a152","campaign_sha256":"471b4f31608781205ce71d497add92d15659003a2a5852f1cc7fb59330b320d3","schema_sha256":"b4cacc60fe730faab91595f3f00b73ddf8729b494413a5eab5fa295e494b8aff","request_sha256":"fa56c7faca15534ac59d329cea3dcd394cf0d4d460108d4da31d6cccb48d7da0"},"started_at":"2026-08-04T22:35:28Z","ended_at":"2026-08-04T22:35:28Z","duration_ms":269,"terminal_state":"SUCCEEDED","exit_code":0,"error":null,"readiness":{"relative_path":"readiness.json","sha256":"d7acf1a4901c4b423dc5785fb17b9c12b29e37a73887d15a0503ed64d8f0b990"},"provenance":{"relative_path":"provenance.json","sha256":"1759f9ddf9b1b28af7fb451ec8bddfcf302a335d4e3ad0537463aabfe3b59f03"},"state_before":{"manifest_sha256":"0000000000000000000000000000000000000000000000000000000000000000"},"state_after":{"manifest_sha256":"0000000000000000000000000000000000000000000000000000000000000000"},"recovery":null,"handoff":null}