{"schema_version":"1.0.0","run_id":"abk:run:artifact-dag-core-v1-abk-native-com-01-normal-primary-r1","request_id":"abk:run-request:artifact-dag-core-v1-abk-native-com-01-normal-primary-r1","campaign_id":"abk:benchmark-campaign:artifact-dag-core-v1","branch":"abk_native","branch_id":"abk_native","case_id":"COM-01-normal-primary","repeat":1,"runner":{"contract_version":"abk-native-runner-v2","executable_sha256":"14cd7ea73cf99bae9ba3b59659341aab80c1d8ed0266bd6e3074e98b4a00954c","host":"codex"},"input":{"fixture_sha256":"62f997d1e3a0aded32dde6468b3ec342d7c3a52d87839deeb7c6cf7a040d1bfe","campaign_sha256":"471b4f31608781205ce71d497add92d15659003a2a5852f1cc7fb59330b320d3","schema_sha256":"b4cacc60fe730faab91595f3f00b73ddf8729b494413a5eab5fa295e494b8aff","request_sha256":"e46c8e2d8d7082f057420b91383a4cffeeff4e9399f46683ba258cdf18a243e5"},"started_at":"2026-08-04T21:14:44Z","ended_at":"2026-08-04T21:14:44Z","duration_ms":355,"terminal_state":"SUCCEEDED","exit_code":0,"error":null,"readiness":{"relative_path":"readiness.json","sha256":"310d205ad5da9abdf405d09ae31a3541f4082071cfaca193c52da6b699d09d21"},"provenance":{"relative_path":"provenance.json","sha256":"7c20785be404355b71032a3386f04ef6900268facb02b763d80de2bc6f4e5ed5"},"state_before":{"manifest_sha256":"0000000000000000000000000000000000000000000000000000000000000000"},"state_after":{"manifest_sha256":"0000000000000000000000000000000000000000000000000000000000000000"},"recovery":null,"handoff":null}