{"schema_version":"1.0.0","run_id":"abk:run:artifact-dag-core-v1-abk-native-com-02-normal-variant-r1","request_id":"abk:run-request:artifact-dag-core-v1-abk-native-com-02-normal-variant-r1","campaign_id":"abk:benchmark-campaign:artifact-dag-core-v1","branch":"abk_native","branch_id":"abk_native","case_id":"COM-02-normal-variant","repeat":1,"runner":{"contract_version":"abk-native-runner-v2","executable_sha256":"14cd7ea73cf99bae9ba3b59659341aab80c1d8ed0266bd6e3074e98b4a00954c","host":"codex"},"input":{"fixture_sha256":"846ed6317d8bf0af1ed2aa2017e647e9d2502db399f451322eebae9fc9806943","campaign_sha256":"471b4f31608781205ce71d497add92d15659003a2a5852f1cc7fb59330b320d3","schema_sha256":"b4cacc60fe730faab91595f3f00b73ddf8729b494413a5eab5fa295e494b8aff","request_sha256":"4c9625b052b7b2b3b9b6d0881928b3d5f997abc7143117e55a3ab86abc3c0c94"},"started_at":"2026-08-04T22:35:21Z","ended_at":"2026-08-04T22:35:21Z","duration_ms":322,"terminal_state":"SUCCEEDED","exit_code":0,"error":null,"readiness":{"relative_path":"readiness.json","sha256":"e3235d59edf7327affe98c560592d1fb735195eed7b46b07f3e4127570f834e2"},"provenance":{"relative_path":"provenance.json","sha256":"d3bed7ff67adbfc8494f2abac4332074abc60a786cabeed39a2af40f1512bf39"},"state_before":{"manifest_sha256":"0000000000000000000000000000000000000000000000000000000000000000"},"state_after":{"manifest_sha256":"0000000000000000000000000000000000000000000000000000000000000000"},"recovery":null,"handoff":null}