{"schema_version":"1.0.0","run_id":"abk:run:artifact-dag-core-v1-abk-native-spc-03-recovery-rollback-r2","request_id":"abk:run-request:artifact-dag-core-v1-abk-native-spc-03-recovery-rollback-r2","campaign_id":"abk:benchmark-campaign:artifact-dag-core-v1","branch":"abk_native","branch_id":"abk_native","case_id":"SPC-03-recovery-rollback","repeat":2,"runner":{"contract_version":"abk-native-runner-v2","executable_sha256":"14cd7ea73cf99bae9ba3b59659341aab80c1d8ed0266bd6e3074e98b4a00954c","host":"codex"},"input":{"fixture_sha256":"ce339295134d2036f96615accc8d1e1e9f7a5fd4c73821b9fab2c868cb0fefaa","campaign_sha256":"471b4f31608781205ce71d497add92d15659003a2a5852f1cc7fb59330b320d3","schema_sha256":"b4cacc60fe730faab91595f3f00b73ddf8729b494413a5eab5fa295e494b8aff","request_sha256":"f7a8acbc3520285a7a605834d8b53df20bc6c6364d8b5b9064ed86f43fdb879e"},"started_at":"2026-08-04T22:35:50Z","ended_at":"2026-08-04T22:35:50Z","duration_ms":290,"terminal_state":"RECOVERED","exit_code":0,"error":{"code":"RECOVERED_AFTER_FAILURE","retryable":false,"message":"Owned derived state was rolled back and the run is resumable.","field":"project.failure_after"},"readiness":{"relative_path":"readiness.json","sha256":"29c0efef68138ee0bd2e7f2885b6c760000593a793883615c569327d0fafd757"},"provenance":{"relative_path":"provenance.json","sha256":"e11d4774c185721d497fa042745615c55d3b092d2a84ebae4729a666b9fd0fbb"},"state_before":{"manifest_sha256":"0000000000000000000000000000000000000000000000000000000000000000"},"state_after":{"manifest_sha256":"0000000000000000000000000000000000000000000000000000000000000000"},"recovery":{"status":"recovered","strategy":"owned-state-only","owned_paths":["derived-state.json"],"removed":true,"graph_sha256":"6fb79ef2a6c9f64e28c94f2f88777ba9006c18c4f47b48643c750b80b5d28410"},"handoff":null}